{
  "$schema": "http://json-schema.org/draft-07/schema#",
  "title": "Empleados",
  "type": "object",
  "x-dynamodb": {
    "partition_key": "local_id",
    "sort_key": "dni"
  },
  "properties": {
    "local_id": { "type": "string" },
    "dni": { "type": "string" },
    "nombre": { "type": "string" },
    "apellido": { "type": "string" },
    "calificacion_prom": { "type": "number", "minimum": 0, "maximum": 5 },
    "sueldo": { "type": "number", "minimum": 0 },
    "role": { "type": "string", "enum": ["Repartidor", "Cocinero", "Despachador"] }
  },
  "required": ["local_id", "dni", "nombre", "apellido", "role"],
  "additionalProperties": false
}
